1,จารครับขอให้พูดเรืองอื่นน้อยหน่อยครับ ตอนหนึ่งจารคุยสไลย์หนึงเป็น2ชัวโมงครับ,2565
2,ขอบคุณครับ,2565
3,สอนไวเกินครับ,2565
4,เป็นวิชาที่เสียงอาจารย์กล่อมให้หลับได้ง่ายๆเพราะเน้นทฤษฎีและพื้นฐานความเข้าใจของนักศึกษาเลยอยากให้มีสิ่งที่มาช่วยดึงความสนใจหรือทดลองแบบทดสอบเล็กๆน้อยๆคับ,2565
5,สอนเร็วไปค่ะ,2565
6,สอนเร็วมาก,2565
7,อาจารย์เก่งจริงอันนี้ยอมรับ แต่แค่เราไม่สามารถตามความเก่งของอาจารย์ได้เบย ขอโทษด้วยครับ/ค่ะ,2565
8,บอกว่าข้อเขียนล้วนก่อนสอบตื่นเต้นดีครับ แต่ไม่อยากตื่นเต้นอีกแล้ว,2565
9,"คาดหวังให้มันจบทุก Layer จริงๆ นะจารย์ 555+
อย่างที่อาจารย์เคยพูด ผมว่ามันโอเครที่จะลองสอนแบบ ไม่ต้องรอมากขนาดนั้นก็ได้ เนื้อหามันสนุกมากครับ อยากเรียนให้จบครบจริงๆ คือพวกผม Sec 3 เก่าตอนปี 1 จะมีคนติวหลักของวิชาอาจารย์โดยเฉพาะอยู่แล้ว อารมณ์แบบนักศึกษาแพทย์นั่งอ่านช่วยเหลือกันก่อนสอบเนื้อหาเดี๋ยวให้เป็นหน้าที่พวกผมสอนๆ กันเอง ก็ได้ครับ รุ่นน้องรุ่นนี้ก็มีบางส่วนทักรุ่นพวกผมอยู่หลายคน น้องเค้าไม่เข้าใจตรงไหนเค้าทักมาตลอดครับ ผมว่ามันทำได้ น่าจะมีช่องทางติดต่ออาจารย์ทางไลน์ก็ดีนะครับ คือว่า ผมค่อนข้างจะเสียเวลาทำความเข้าใจเนื้อหาบางส่วนเอง ถ้าถามตรงๆ อาจจะทำเนื้อหาต่างๆ ทันก่อนสอบ",2565
10,จารย์สอนดีแล้วค่ะ ทำให้เนื้อหาส่วนใหญ่เข้าใจง่ายขี้น ตอนอธิบายเพิ่มอาจารย์ลองเขียนใส่สักอย่างที่ทั้งห้องจะเห็นชัดไหมค่ะ,2565
11,ขอคะแนนจากลมฟ้าอากาศกลับคืนมา,2565
12,สอนดีนะครับ หมายถึงว่าผู้สอนเข้าใจเนื้อหาในการสอนทั้งหมด แต่สอนได้ไวมากครับ ช่วยลดความเร็วลงหน่อยก็ดีนะครับ,2565
13,สอน lap เร็วเกินไปครับ,2565
14,"ปัญหาเพื่อนๆ ไม่ได้อยู่ที่เนื้อหาแลป ปัญหาอยู่ที่เพื่อนๆผม พิมพ์กันช้าครับ เลยไม่ทันเนื้อหาแลปกันเยอะ เลยปล่อยวิชานี้กัน ลองพิมพ์คำสั่งนึงแล้วหยุดสักนิดนึงอธิบายหน่อยว่าผลที่ควรจะออกมาเป็นอะไรแล้วค่อยกด Enter เพื่อโชว์ผลลัพธ์ก็ได้ครับ เปิดแชร์จอก็ดีครับบางคนมองไม่เห็นอันนี้ก็ปัญหาหลัก 
โดยรวมถือว่าดีมากครับขอโทดแทนเพื่อนผมด้วยนะครับ 555+ ปลายทาง = Destiny โชคชะตา อยู่คนละห้องกันแต่เพื่อนมาเล่าหลายๆ อย่างให้ฟังครับ",2565
15,อาจารย์สอนดีมากครับ แต่วิชายากมาครับ,2565
16,ช่วยทำโครงงานจนเสร็จได้ครับ,2565
17,ทุกอย่าง Perfect,2565
18,อยากให้ตอนปฎิบัติลดความเร็วลงหน่อยครับพิมพ์ตามไม่ค่อยจะทัน,2565
19,รบกวนครูยกตัวอย่างการเขียนโค้ดให้เข้าใจกว่านี้นิดนึงครับ,2565
20,ไม่ค่อยเข้าใจเรื่องที่เรียนเท่าไหร่เลยค่ะ,2565
21,โดยรวมอาจารย์ผู้สอนมีการเรียนการสอนอยู่ในระดับเกณฑ์ที่ดีค่อนข้างพึงพอใจในการเรียนการสอนครับ,2565
22,สอนเร็วค่ะ,2565
23,สอนเร็วไปนิดครับ,2565
24,อาจารย์สอนดีนะคะ แต่ถ้ามีตัวอย่างให้ดูเยอะๆ และแบบฝึกที่มีโจทย์หลากหลายให้นักศึกษาลองทำจะดีมากๆค่ะ ถ้าได้คอมที่เร็วแรงกว่านี้จะดีมากๆๆเลยค่ะ,2565
25,อาจารย์ใจดีมากๆเลยค่ะ ไม่เข้าใจตรงไหนถามได้หมด ตอบไลน์ไวมากๆ ปรึกษาได้ตลอด,2565
26,สอนใช้พวก Mongo DB ด้วยก็ดีครับ,2565
27,ผ่านครับ,2565
28,"อยากให้โปรเจคจบเพิ่มความยากหน่อยครับ จะได้ให้เหมือนซ้อมทำโปรเจคใหญ่ต้องซื้อของนั่นนี่นู้น รวมกลุ่มกันทำ 4 คนแบบจริงจัง อยากได้ภายแบบนี้มากครับ
เห็นเพื่อนมหาลัยอื่นเล่ามาดูน่าสนุกมากครับ",2565
29,เรียนออนไลน์ สัปดาห์แรกๆที่มีคลิปที่ อาจาร์ยอัดไว้แล้ว ให้นักศึกษาไปนั่งดูเอง แล้ว อาจาร์ยนัดมาทำควิช ผมรู้สึกว่ามันดีกว่า,2565
30,อาจารย์บางทีปล่อยช้า เนื้อหาที่สอน บางตัวไม่ได้ใช้ และ เวลาการสอนหลายๆบทเรียนไม่ทัน แต่รวมๆดีครับ ได้สนุกกับการเขียนเว็บมากๆ,2565
31,เนื้อหาเยอะดีค่ะแต่ตามไม่ทัน,2565
32,การเรียนการสอนดีมาก สอนได้เข้าใจและปฏิบัติตามได้ดี แต่ไม่ควรขึ้นเสียงใส่นักศึกษาในขณะที่นักศึกษาพูดจาดีๆด้วย การกระทำตุบโต๊ะและตะหวาดเสียงใส่นักศึกษาต่อหน้าทุกคนมันเป็นการกระทำที่ก่อให้เกิดความอับอาย เพราะไม่ใช่นักศึกษาทุกคนที่จะชอบด้านคอมพิวเตอร์หรือมีความรู้ด้านคอมพิวเตอร์ ควรจะใจเย็นและพูดจากับนักศึกษาให้ดีกว่านี้ การกระทำในวันนั้นมันทำให้นักศึกษาฝังใจและไม่อยากเรียนวิชาที่เกี่ยวกับคอมพิวเตอร์อีกเลย,2565
33,"อาจารย์มีการสอนไปด้วย และแทรกอารมณ์ขันเข้าไปด้วยเพื่อไม่ให้นักศึกษาเครียดเกินไป
และการเรียนการสอนในแต่ละอาทิตย์จะมีใบระบุเป็นกิจลักษณะชัดเจน",2565
34,บางทีอาจารย์สอนเร็วไปหน่อยค่ะ แต่โดยรวมแล้วอาจารย์สอนเข้าใจได้ง่าย ขอบคุณค่ะ :),2565
35,ตอนสอบเราต้องการสมาธิมากๆค่ะ แต่ตลอดการสอบอาจารจะพูดคุยหรือบางครั้งก็ขำคิกคักตลอดค่ะ จริงๆอาจารคุยได้นะคะแต่ปิดไมค์เถอะค่ะ เด็กไม่มีสมาธิ เวลาให้ทำข้อสอบก็น้อย อาจารยังพูดเสียงดังอีกค่ะ การเรียนการสอนดีมากแล้ว ติดแค่ตรงนี้ค่ะ,2565
36,อยากให้อุปกรใน มหาวิทยาลัย ดีกว่านี้,2565
37,อาจารย์ใจดี ช่วยสอนนศ.ถ้านศไม่เข้าใจในห้อง,2565
38,สอนไวไป,2565
39,อาจารย์สอนเข้าใจให้งานไวแล้วก็พูดดีมากๆด้วยค่ะ เนื้อหาครบ แต่อยากให้อาจารย์พูดลดความเร็วตอนสอนลงนิดนึงค่ะ ขอบคุณค่ะอาจารย์สำหรับเทอมนี้ ขอ A ทีนะคะ,2565
40,ครูผู้สอนใจดีมากไม่เข้าใจตรงไหนถามได้ตลอด,2565
41,อาจารย์สอนเข้าใจดีค่ะ แต่อาจารย์พูดเร็วเกิน รอนักศึกษาก่อน555,2565
42,สอนเข้าใจง่าย แสอนเข้าใจง่าย แต่เวลาออกข้อสอบยากมากมากคะ อยากให้อาจารย์ออกง่ายกว่านี้นิดหนึ่ง #อาจารย์น่ารัก,2565
43,อยากให้อาจารย์รับความคิดเห็นของนักศึกษาบ้างค่ะ,2565
44,แอร์ที่ห้องเรียนร้อนทุกสัปดาห์ อยากให้ปรับปรุง,2565
45,อาจารย์ควรมีไมค์นะคะ,2565
46,อาจารย์ใจดีคะ ถ้าใครไม่เข้าใจอาจารย์ก็จะอธิบายให้เข้าใจมากขึ้น มีแบบฝึกหัดมากให้ทำเสมอ มีสื่อประกอบการเรียนเสมอ ได้ทำแบบฝึกหัดตามอาจารย์ไปพร้อมกันซึ่งสามารถนำไปใช้ในชีวิตประจำวันได้ด้วยคะ,2565
47,แอร์ร้อนมากกก,2565
48,อาจารย์สอนบางทีไม่ค่อยเข้าใจคะอาจารย์ชอบพูดไวตามไม่ค่อยทันคะ,2565
49,สอนเร็วไป,2565
50,อาจารย์สอนดีแต่สอนไวไปในบางที,2565
51,อยากให้อาจารย์ออกสูตรเกี่ยวกับข้อเขียนลดลงหน่อยค่ะ,2565
52,ส่งงานย้อนหลังไม่ได้ค่ะ,2565
53,อาจารย์ทำการสอนดีเข้าใจง่ายแต่เนื้อหาอาจมีเยอะยากที่จะสรุปไปบ้าง แต่ก็ถูกแทนด้วยความใจดีและให้โอกาสนักศึกษาได้ลองผิดถูกก่อนการวัดปลจริงมีแบบทดสอบต่างๆที่พัฒนาการช่วยจำได้ดีและยังน่าสนใจคับ,2565
54,สอนทีเหมือนอาจารย์กำลังแร็ปเหมือนไม่ได้มาเรียนเหมือนมาดูเดอะแร็ปเปอร์แต่อาจารย์ก้สอนดีค่ะอาจารย์ให้โอกาสเสมอ,2565
55,อาจารย์สอนดีมากๆเลยค่ะ พอไม่เข้าใจก็จะย้ำจนกว่าจะจำได้,2565
56,เมตตาหนูหน่อยนะคะ,2565
57,ดีดีดีดี,2565
58,แรกๆงง หลังๆตื่นเต้่นครับ,2565
59,ดีย์,2565
60,ตรรกะการสอนของอาจารย์ และ วิธีการสอนของอาจารย์ค่อนข้างดีเลย แต่หนูขอฝากบางอย่างไว้นิดนึงในบางทีการที่เด็กเรียนกับอ.คนนั้นคนนี้มาแล้วก็ไม่ได้ความว่าเด็กจะเข้าใจที่อ.คนนั้นนี่สอน เหมือนกับวิชาเอง บางทีหนูอยากให้อาจารย์ลองมองภาพรวมของเด็กบ้างว่า1ใน10มีคนทำวิชาอาจารย์ได้ดีมากแค่ไหนแล้วอยากให้อาจารย์ลองมองย้อนกลับมาดูการสอนของตัวเองสักนิดว่าถ้าเด็ก30กว่าคนมีเข้าใจอยู่10กว่า แบ้ว20กว่าคนที่ไม่เข้าใจอาจารย์จะปบ่อยไปเลยหรือ ที่เหงืออีก20คนมันต้องทีสัก10คนที่พยายามตั้งใจ แต่ก็ไม่เข้าใจอยู่ดี หนูอยากให้อาจารย์ลองปรับเปลี่ยนหรือหาวิธีการสอนเพื่อให้เด็กจำแค่สอบผ่าน แต่ว่าให้เด็ก จำสอบผ่านแบะเข้าใจจริงๆ หนูไม่รู้การประเมินตรงนี้อาจารย์จะได้อ่านมั้ยหรือมีผลต่อคะแนนหรือเปล่า แต่คือความคิดเห็นส่วนตัวหนูค่ะ,2565
61,"ผมชอบที่น.ศ.สามารถเลือกการเก็บคะเเนนได้ เเต่อยากให้เพิ่มตัวเลือกสำหรับคะแนนถามตอบที่นอกเหนือจากการสอบ เพราะการถามตอบอาจทำให้น.ศ.บางส่วนรู้สึกเครียดเเละกดดันซึ่งส่งผลต่อการเรียนรู้ โดยส่วนตัวผมมองว่าอาจารย์สอนได้ดีเเละมีการออกเเบบ รูปเเบบการเก็บคะเเนนที่ดีครับ

ขอบคุณครับ",2565
62,ขอบคุณที่สอนวิชาโหดขนาดนี้ ผ่านร้อนผ่านหนาวมาได้ด้วยประสบการณ์ทะเลาะกันในกลุ่มจนเกือบแตกหัก555 แต่รวมสนุกมากคับเป็นวิชาที่ทำให้ตัวเองรู้สึกมีประโยชน์กับเพื่อนๆและเก่งนะเนี่ยเรา,2565
63,ขอบคุณที่สอนวิชาโหดขนาดนี้ ผ่านร้อนผ่านหนาวมาได้ด้วยประสบการณ์ทะเลาะกันในกลุ่มจนเกือบแตกหัก555 แต่รวมสนุกมากคับเป็นวิชาที่ทำให้ตัวเองรู้สึกมีประโยชน์กับเพื่อนๆและเก่งนะเนี่ยเรา,2565
64,สอนเร็วมาก ตามไม่ทัน,2565
65,คอมค้างบ่อย ช่วยปรับปรุงและพัฒนาให้คอมพิวเตอร์ดีขึ้นหน่อยครับ,2565
66,อยากให้เข้าถึงกับศึกษาทุกคน สามารถปรึกษาได้ตลอดเวลา,2565
67,อาจารย์เป็นคนที่มีสกิลในการเขียนเทพมากคร้า,2565
68,อาจาร์ยสอนดีมาก แต่สอนเร็วไปหน่อย แต่ไปถามนอกรอบอาจาร์ยก็อธิบายได้เข้าใจ,2565
69,อาจารย์สอนเร็วไปจนตามไม่ค่อยทันครับ,2565
70,ช่วยอธิบายเนื้อหาอย่างละเอียดให้เเก่นักศึกษารู้ถึงที่มาเกี่ยวกับเนื้อหานั้นๆ,2565
71,อาจารย์สอนไวมากเลยคะ,2565
72,อ่านลายมืออาจารย์ไม่ค่อยออกครับ,2565
73,อาจารย์สอนเร็วเกินไป,2565
74,งานเยอะ,2565
75,อย่าพยายามพูดนอกเหนือการสอนเยอะนะครับ นศ.บางคนเค้าไม่ได้อยากรับรู้นะครับจารย์ กราบเรียนมาเพื่อแนะนำ ไม่ได้ว่าหรือถือโกรธ ถือว่าผมแนะนำ,2565
76,สอนเข้าใจดี แต่สอนเร็วไป นักศึกษาบางคนตามไม่ทัน งานเยอะมาก ควรให้พักบ้างระหว่างเรียน,2565
77,อยากให้อาจารย์เตียมความพร้อมในการเตรียมการเรียนการสอน พวกเเอปพลิดคชั่นต่างๆ รวมๆสอนดีเป็นกันเองกับเด็ก,2565
78,อยากให้อาจารย์ปรับการให้การบ้านนักศึกษาเพราะบาวคนอาจไม่มีคอมไม่มีโปรแกรมบางคนทำงานหาค่าเทอมเองอยสกให้เข้าใจและสั่งงานน้อยบงหน่อยค่ะ,2565
79,ด้วยรูปแบบการเรียนการสอนออนไลน์ บางส่วนนักศึกษาไม่มีความพร้อมหรือความสามารถในการทำงานเช่นเรื่องทุนศัพท์ในการซื้อโปรแกรมหรืออุปกรณ์การเรียน อยากให้อาจารย์ปรับเนื้อหาการสอนให้เหมาะสมกับตัวนักศึกษาด้วยค่ะ,2565
80,ตรงๆเลยนะคะ จริงๆแล้วอาจารย์ควรจะปรับปรุงการสอนให้สอดคล้องกับสถานการณ์แล้วไม่ใช่เด็กทุกคนเรียนคอมแล้วต้องมีแอปนู้นแอปนี้นะคะ หนูเสียเงิน1000กว่าบอกเพื่อซื้อแอปมาทำงานและหนูใช้ครั้งเดียวแล้วไม่เกี่ยวกับสายงานหนูด้วยค่ะ อยากให้อาจารย์เอาตรงนี้ไปปรับปรุงตรวจสอบนักศึกษาให้เข้าใจ การเรียนแบบนี้ควรเรียนที่มหาลัยค่ะ การหาแอปการเรียนการสอนไม่ใช้เรื่องของนักศึกษาที่ต้องรับผิดชอบแต่เป็นเป็นมหาลัยที่ต้องจัดการและตัวอาจารย์เอง ขอบคุณค่ะ,2565
81,อาจารย์สอนอะไรเยอะแยะเลย ปรับใช้ได้จริง,2565
82,สอนดีมากครับ แต่อยากให้ปรับเนื้อหาให้เข้าใจครับแต่โดยดีมากๆครับ,2565
83,อาจารย์พูดเร็วไปหน่อย,2565
84,อาจารย์ต้องขอ License Adobe มาให้ได้นะจารย์เนื้อหาที่ผมคาดหวังจริงๆ คือ Photoshop Premier Pro นะเอาจริงๆ 5555+ ตั้งแต่งาน 3D ไปเริ่มไม่ค่อยสนุกละครับ Photopea อยากให้เพิ่มเนื้อหาสอนทำ Timeline ทำอนิเมชั่นใน Photopea แล้วก็อยากให้เน้นไปที่ตัดรูปเอาสักสองคาบนั่งฝึกใช้ Tools ตัดรูปแล้วจบท้ายด้วยทำโปสเตอร์หนังก็ได้ครับ น่าสนุกดีครับ ผมเคยเรียนที่โรงเรียนสนุกมากเลยเพิ่มเนื้อหาการลบริ้วรอยบนหน้าด้วย clone stamp อันนี้ทีเด็ดท้าทายมาก สนุกมากด้วย,2565
85,อาจารย์สอนดี ใจดีมากค่ะ สามารถถามได้ตลอด แต่แอบบไปเร็วมาก,2565
86,ไม่เคยเรียนกับคนนี้ครับ พอใช้ทั้งหมดละกัน ถือว่าไม่รู้อะไรเลย ไม่มาสอนไม่เคยเรีบนด้วย,2565
87,อ.ควรปิดไมค์ในขณะที่ให้ผู้เรียนทำแบบทดสอบต่างๆ,2565
88,อาจารย์ควรปิดไมค์ตอนทำแบบทดสอบ เพราะจะรบกวนสมาธิผู้เรียน,2565
