89,อาจารย์สอนเข้าใจง่ายดีค่ะ แต่บางทีก็ดูลายมืออาจารย์ไม่ออก5555,2565
90,อาจารย์สอนเร็วมากค่ะ ไม่ค่อยเข้าใจต้องไปศึกษาหาความรู้ต่อด้วยตัวเอง,2565
91,แนะนำให้ทำการสื่อสารให้นิสิตเข้าใจในเนื้อหามากกว่านี้ เช่น การพูดที่ไม่ยาวมากแต่กระชับชัดเจน,2565
92,เตรียมสื่อการสอนไว้ด้วย,2565
93,มีบางจุดที่อาจารย์สอนไปเร็วมากๆ ตามเนื้อหาไม่ค่อยทัน,2565
94,สอนเร็ว,2565
95,สอนดีค่ะ,2565
96,อาจารย์แร็ปสอนค่ะไม่รู้ว่ารีบไปไหนแต่ว่าไม่ทันอาจารย์ก็จะทวนแต่ก็ไม่ทันอยู่ดีมาเรียนเหมือนมานั่งดูเดอะแร็ปเปอร์แต่อาจารย์ให้โอกาสที่ดีค่ะส่งงานช้าก็ให้คะแนนเหมือนเดิม,2565
97,ดีย์,2565
98,สั่งการบ้าน โดยบอกว่าจะนำโจทย์ขึ้น classroom แต่ไม่ได้เอาลงไว้ให้ และยังให้ส่ง,2565
99,แอร์ที่ห้องหนาวจริงๆค่ะ,2565
100,ควรเข้าสอนให้ตรงเวลา เวลาสอนไม่ควรยืดเยื้อเกินไป,2565
101,เกรดไม่ยุติธรรม ไปทุกวันจันทร์ ตรงเวลา ไม่เคยขาดเรียน น่าจะมีคะแนนจิตพิสัย ได้สักเกรด B+ เกรด B เป็นอย่างน้อย แต่ได้ C+ ฉุดเกรดทั้งหมดมากๆ วิชานี้พยายามตั้งใจที่สุดแล้ว อาจจะมีคุยบ้างถามเพื่อนข้างๆบ้าง แต่ ครูน่าจะให้เกรด ความพยายามมาเรียนและส่งงานใน ชั่วโมง ทุกครั้ง มากกว่าคะแนนสอบ (คะแนนสอบไม่ตกด้วย),2565
102,เวลาที่นักศึกษาถามปัญหาเรื่อง code มัน bug ช่วยกรุณาตอบให้ชัดเจนทีครับบางทีถามไปเป็นสิบบรรทัดแต่อาจารย์กลับส่งสติกเกอร์มาตัวเดียวคืออะไรหรอครับ แล้วเวลานักศึกษาถามมากๆมันก็เป็นการที่ดีไม่ใช่หรอครับไมใช่ถอนหายใจใส่นักศึกษาครับ,2565
103,อาจารย์ควรพักนะครับ,2565
104,ขอให้อ.ดูแลสุขภาพด้วยนะคะ,2565
105,เนื้อหาที่สอนสามารถนำมาประยุกต์ใช้ได้จริง วิชามันยาก แต่อาจารย์พยายามหาเทคนิคการจำให้เราง่ายๆ ขอบคุณค้าาาาาาาาา,2565
106,อยากให้มีเรียนออนไลน์ในวันที่สภาพอากาศไม่ดี งับ <3,2565
107,ถ้าอาจารย์ให้เช็คคะแนนเองว่าอาจารย์กรอกครบไหม อาจารย์น่าจะแจ้งวันตัดเกรดด้วยนะคะหนูจะได้ลางานมารีบเช็ครีบแจ้งก่อนวันตัดเกรด ขอบคุณค่ะ^^,2565
108,อยากให้เอกสารประกอบการสอนเป็นภาษาไทยให้อ่านเข้าใจง่าย และอยากให้สั่งงานกลุ่มให้ตรงกับเรื่องที่สอน,2565
109,บางครั้งสอนไวไปค่ะตามไม่ค่อยทัน,2565
110,อยากได้พัดลม,2565
111,อาจารย์ให้คำแนะนำดีค่ะ,2565
112,ทีหลังช่วยสอนmath random ก่อนสอบด้วยครับแล้วก็เรื่องData base เรื่องการดึงข้อมูลในdataมาใช้ จารย์ไม่สอนผมก็ทำโปรเจคที่จารย์สั่งไม่ได้คะแนนผมก็หายสิครับแบบนี้ จารย์สั่งให้ทำเกินที่สอนไปหน่อยครับ แต่เรื่องที่สอนในห้องสอนเข้าใจ ถ้าจารย์สอนผมมั่นใจว่าพวกผมทำได้ เทอมนี้ขอบคุณมากครับ,2565
113,อาจารย์สอนดีมากครับ,2565
114,ลายมือมีความอ่านยากครับ ขออ่านง่ายกว่านี้อีกนิดนึง,2565
115,บันทึกสไลด์หลังจากการสอนเสร็จด้วยครับ ขอบคุณครับ,2565
116,ปานกลาง,2565
117,อยากให้อาจารย์สนใจในการตรวจการบ้านหน่อยคับแล้วอยากได้ช่องทางการติดต่ออาจารย์ด้วยคับ,2565
118,ไม่บอกแนวข้อสอบ เนื้อหาไม่เข้าใจ เหมือนอ่านให้ฟัง ผมไม่นับว่าเป็นการสอน เป็นการเล่าสู่กันฟัง,2565
119,อาจารย์?ใจดีเป็นกันเอง สอนเข้าใจง่าย,2565
120,ควรแจ้งอะไรล่วงหน้ามากกว่านี้ ไม่ใช่เรียน8โมง แจ้งยกคลาสตอน7โมง นักศึกษาบางคนตื่นแต่เช้าเพื่อเดินทางมามหาวิทยาลัยแต่ต้องกลับไปบ้านเพราะอาจารย์ยกคลาส,2565
121,อาจารย์สอนสนุกมากครับ,2565
122,ควรบอกแนวข้อสอบนักศึกษาค่ะ,2565
123,อาจารย์สอนดีมากครับ ได้รับความรู้ใหม่และเทคนิคต่างๆสามารถนำมาปรับใช้ในการประกอบอาชีพและโครงานได้เยอะเลยครับ,2565
124,ควรบอกแนวข้อสอบนักศึกษาค่ะ,2565
125,อยากให้อาจารย์ แปลอังกฤษให้ด้วยค่ะ บางทีมัน งงๆ,2565
126,ดีมากครับ,2565
127,อาจารย์สอนเก่งมากค้าบบบ นศ เลย อยากตั้งใจเรียนไปด้วย,2565
128,อยากให้อาจารย์เตรียมการสอน และทำสไลด์ให้ดูเข้าใจง่ายกว่านี้คะ หนูรู้สึกว่าอาจารย์สอนแล้วรู้สึกไม่มั่นใจในคำตอบเลยทำให้ตอนเรียนหนูไม่ค่อยเข้าใจว่าทำแบบนี้ถูกไหม คำตอบถูกหรือยังคะ และหนูก็คิดว่าสิ่งที่อาจารย์สอนมันดูเข้าใจง่ายก็จริงแต่ตอนอธิบายมันทำให้หนูรู้สึกขัดแย้งนิดนึงคะ อยากให้อาจารย์ปรับเรื่องนี้ด้วยคะ ขอบคุณค่ะ :):):):):):):):):):):):):):):):):):),2565
129,อาจารย์บางทีเตรียมพร้อมเนื้อหามาสอนยังไม่ค่อยดี ทำให้นักศึกษาไม่ค่อยเข้าใจ และเรื่องเวลาอาจารเข้าสอนช้าบ่อย แต่อาจารย์เอาใจใส่เด็กมากๆ ใจดี และให้คำปรึกษาดี เข้ากับเด็กง่าย. เป็นกันเอง,2565
130,ปานกลาง,2565
