id,comment,score,polarity,created_at,updated_at
229,สอนทีเหมือนอาจารย์กำลังแร็ปเหมือนไม่ได้มาเรียนเหมือนมาดูเดอะแร็ปเปอร์แต่อาจารย์ก้สอนดีค่ะอาจารย์ให้โอกาสเสมอ,85.71,positive,"2024-07-31 17:01:18","2024-07-31 17:01:18"
230,ดีมากครับ,83.33,positive,"2024-07-31 17:01:18","2024-07-31 17:01:18"
231,ขอบคุณที่ให้ความช่วยเหลือตลอด,85.71,positive,"2024-07-31 17:01:18","2024-07-31 17:01:18"
232,ปานกลาง,0,neutral,"2024-07-31 17:01:18","2024-07-31 17:01:18"
233,อาจารย์สอนดีครับ,75,positive,"2024-07-31 17:01:18","2024-07-31 17:01:18"
234,"อาจารย์สอนดีมากๆเลยค่ะ พอไม่เข้าใจก็จะย้ำจนกว่าจะจำได้",0,neutral,"2024-07-31 17:01:18","2024-07-31 17:01:18"
235,ดีมากครับ,83.33,positive,"2024-07-31 17:01:18","2024-07-31 17:01:18"
236,เมตตาหนูหน่อยนะคะ,66.67,positive,"2024-07-31 17:01:18","2024-07-31 17:01:18"
237,"ไม่ควรใช้การสุ่ม นักศึกษาจหัวใจวายเอาครับ",66.67,negative,"2024-07-31 17:01:18","2024-07-31 17:01:18"
238,ดีมากชอบมากประทับใจในอาจารย์ผูเสอน,97.83,positive,"2024-07-31 17:01:18","2024-07-31 17:01:18"
239,ดีดีดีดี,0,neutral,"2024-07-31 17:01:18","2024-07-31 17:01:18"
240,"แรกๆงง หลังๆตื่นเต้่นครับ",66.67,negative,"2024-07-31 17:01:18","2024-07-31 17:01:18"
241,สนุกมากครับวิชานี้,66.67,positive,"2024-07-31 17:01:18","2024-07-31 17:01:18"
242,"สอนเข้าใจค่ะ เรียนสนุกดี อยากเรียนกับอาจารย์ทุกเทอม  เทอมหน้าไม่มีเรียนกับอาจารย์แล้ว งื้อๆ TT",85.71,positive,"2024-07-31 17:01:18","2024-07-31 17:01:18"
243,ดีมากครับ,83.33,positive,"2024-07-31 17:01:18","2024-07-31 17:01:18"
244,ขอบคุณครับ,75,positive,"2024-07-31 17:01:18","2024-07-31 17:01:18"
245,อธิบายเนื้อหาเข้าใจง่ายมากค่ะ,66.67,positive,"2024-07-31 17:01:18","2024-07-31 17:01:18"
246,"อาจารย์สอนเก่งมากค้าบบบ นศ เลย อยากตั้งใจเรียนไปด้วย",85.71,positive,"2024-07-31 17:01:18","2024-07-31 17:01:18"
247,ดีมากครับ,83.33,positive,"2024-07-31 17:01:18","2024-07-31 17:01:18"
248,สอนเข้าเเละค่อยเป็นค่อยไป,66.67,positive,"2024-07-31 17:01:18","2024-07-31 17:01:18"
249,ดีย์,0,neutral,"2024-07-31 17:01:18","2024-07-31 17:01:18"
250,"อาจารย์น่ารักมากๆค่า เป็นกันเองสุดๆมีอะไรไม่เข้าใจหรือทำไม่ได้ก็แค่ถาม อาจารย์ก็จะมาในทันใดจะไปยืนเคียงข้างเธอ เป็นคาบเรียนที่หนูเอ็นจอยมากๆค่า",84.21,positive,"2024-07-31 17:01:18","2024-07-31 17:01:18"
251,ดีคับ,75,positive,"2024-07-31 17:01:18","2024-07-31 17:01:18"
252,ขอบคุณ,75,positive,"2024-07-31 17:01:18","2024-07-31 17:01:18"
253,"อยากให้อาจารย์เเก้ไขในส่วนของการสอนเเละการอธิบาย เพราะ การสอนที่ผ่านมานั้นไม่ค่อยจะดีสักนักไม่ค่อยมีการสอนเเบบปฎิบัติให้นักศึกษาได้ทำความเข้าใจกับวิชาเเต่ในด้านของทฤษฎีดูโอเคเเล้วไม่มีปัญหาเเต่การอธิบายดูที่จะไม่ค่อยครอบคลุมมากนัก อยากให้อาจารย์ปรับปรุงในส่วนนี้ด้วย ขอบคุณครับ",72.73,negative,"2024-07-31 17:01:18","2024-07-31 17:01:18"
254,"ชอบการสอนของอาจารย์มากค่ะ มีให้ตอบคำถามทำให้เข้าใจได้ง่ายมากขึ้นและสนุกขึ้นค่ะ",96,positive,"2024-07-31 17:01:18","2024-07-31 17:01:18"
255,"ตรรกะการสอนของอาจารย์ และ วิธีการสอนของอาจารย์ค่อนข้างดีเลย แต่หนูขอฝากบางอย่างไว้นิดนึงในบางทีการที่เด็กเรียนกับอ.คนนั้นคนนี้มาแล้วก็ไม่ได้ความว่าเด็กจะเข้าใจที่อ.คนนั้นนี่สอน เหมือนกับวิชาเอง บางทีหนูอยากให้อาจารย์ลองมองภาพรวมของเด็กบ้างว่า1ใน10มีคนทำวิชาอาจารย์ได้ดีมากแค่ไหนแล้วอยากให้อาจารย์ลองมองย้อนกลับมาดูการสอนของตัวเองสักนิดว่าถ้าเด็ก30กว่าคนมีเข้าใจอยู่10กว่า แบ้ว20กว่าคนที่ไม่เข้าใจอาจารย์จะปบ่อยไปเลยหรือ ที่เหงืออีก20คนมันต้องทีสัก10คนที่พยายามตั้งใจ แต่ก็ไม่เข้าใจอยู่ดี หนูอยากให้อาจารย์ลองปรับเปลี่ยนหรือหาวิธีการสอนเพื่อให้เด็กจำแค่สอบผ่าน แต่ว่าให้เด็ก จำสอบผ่านแบะเข้าใจจริงๆ หนูไม่รู้การประเมินตรงนี้อาจารย์จะได้อ่านมั้ยหรือมีผลต่อคะแนนหรือเปล่า แต่คือความคิดเห็นส่วนตัวหนูค่ะ",999,negative,"2024-07-31 17:01:18","2024-07-31 17:01:18"
256,การสอนดีมากครับเช็กนศ.ได้ดีเลยว่ารู้เรื่องที่เรียนจริงไหม,90.91,positive,"2024-07-31 17:01:18","2024-07-31 17:01:18"
257,"ไม่ชอบเรียนระบบถามตอบได้คะแนน มันกดดันเกินไป",95.24,negative,"2024-07-31 17:01:18","2024-07-31 17:01:18"
258,ขอช่วยลดความตึงเครียดในการสอนและการให้คะแนนนักศึกษาหน่อยครับเพราะบางนักศึกษาก็ไม่สามารถตอบคำถามแล้วได้คะแนนครับควรมีคะแนนที่ช่วยนักศึกษาหน่อยครับเช่นการทำการบ้านหรืออื่นๆก็ตามครับ,85.71,negative,"2024-07-31 17:01:18","2024-07-31 17:01:18"
259,"ผมชอบที่น.ศ.สามารถเลือกการเก็บคะเเนนได้ เเต่อยากให้เพิ่มตัวเลือกสำหรับคะแนนถามตอบที่นอกเหนือจากการสอบ เพราะการถามตอบอาจทำให้น.ศ.บางส่วนรู้สึกเครียดเเละกดดันซึ่งส่งผลต่อการเรียนรู้ โดยส่วนตัวผมมองว่าอาจารย์สอนได้ดีเเละมีการออกเเบบ รูปเเบบการเก็บคะเเนนที่ดีครับ
 ขอบคุณครับ",90,positive,"2024-07-31 17:01:18","2024-07-31 17:01:18"
260,สอนไม่เข้าใจ,75,negative,"2024-07-31 17:01:18","2024-07-31 17:01:18"
261,ออกข้อสอบยากไปครับ,75,negative,"2024-07-31 17:01:18","2024-07-31 17:01:18"
262,"ขอบคุณที่สอนวิชาโหดขนาดนี้ ผ่านร้อนผ่านหนาวมาได้ด้วยประสบการณ์ทะเลาะกันในกลุ่มจนเกือบแตกหัก555 แต่รวมสนุกมากคับเป็นวิชาที่ทำให้ตัวเองรู้สึกมีประโยชน์กับเพื่อนๆและเก่งนะเนี่ยเรา",0,neutral,"2024-07-31 17:01:18","2024-07-31 17:01:18"
263,"ขอบคุณที่สอนวิชาโหดขนาดนี้ ผ่านร้อนผ่านหนาวมาได้ด้วยประสบการณ์ทะเลาะกันในกลุ่มจนเกือบแตกหัก555 แต่รวมสนุกมากคับเป็นวิชาที่ทำให้ตัวเองรู้สึกมีประโยชน์กับเพื่อนๆและเก่งนะเนี่ยเรา",0,neutral,"2024-07-31 17:01:18","2024-07-31 17:01:18"
264,อาจารย์สอนดีมากค่ะ,83.33,positive,"2024-07-31 17:01:18","2024-07-31 17:01:18"
265,ดีคับ,75,positive,"2024-07-31 17:01:18","2024-07-31 17:01:18"
266,สนุกมากครับ,66.67,positive,"2024-07-31 17:01:18","2024-07-31 17:01:18"
267,"ช่วยสอนให้ช้าลงหน่อยค่ะ ตามไม่ทัน",92.31,negative,"2024-07-31 17:01:18","2024-07-31 17:01:18"
268,"สอนค่อนข้างเร็ว ตามไม่ทัน",999,negative,"2024-07-31 17:01:18","2024-07-31 17:01:18"
269,"สอนเร็วมาก ตามไม่ทัน",999,negative,"2024-07-31 17:01:18","2024-07-31 17:01:18"
270,"คอมค้างบ่อย ช่วยปรับปรุงและพัฒนาให้คอมพิวเตอร์ดีขึ้นหน่อยครับ",60,positive,"2024-07-31 17:01:18","2024-07-31 17:01:18"
271,สอนเข้าใจง่าย,66.67,positive,"2024-07-31 17:01:18","2024-07-31 17:01:18"
272,"ควรเปิดโอกาสให้นักศึกษาใช้เทคนิคในการสอนได้หลายรูปแบบ ไม่ควรมีเทคนิคตายตัวในสถานที่ทำงานจริง ลำบาก",75,negative,"2024-07-31 17:01:18","2024-07-31 17:01:18"
273,"ทำให้เข้าใจขั้นตอนการพัฒนาสื่อมัลติมีเดียมากขึ้น ลึกขึ้น",66.67,positive,"2024-07-31 17:01:18","2024-07-31 17:01:18"
274,"เข้าใจระบบการทำงานของมัลติมีเดีย ในโปรแกรมต่างๆมากขึ้นครับ",66.67,positive,"2024-07-31 17:01:18","2024-07-31 17:01:18"
275,"คอมช้าไปหน่อยครับ ตอนทำโมเดล 3D ค้างบ่อยมาก",80,negative,"2024-07-31 17:01:18","2024-07-31 17:01:18"
276,"คอม Ram น้อยไม่พอกับโปรแกรม อาจารย์สอนเร็วมากกกกกกกๆๆๆๆๆๆๆๆๆๆๆๆๆๆๆๆๆ ตามไม่ทัน",999,negative,"2024-07-31 17:01:18","2024-07-31 17:01:18"
277,"อาจารย์สอนไว พูดไว ไปไวเกินไป ควรที่จะอธิบายช้าลงและทำตามพร้อม ๆ กัน",999,negative,"2024-07-31 17:01:18","2024-07-31 17:01:18"
278,"เครื่อง PC ไม่พร้อมต่อการเรียนการสอน ช้า ค้าง",94.12,negative,"2024-07-31 17:01:18","2024-07-31 17:01:18"
279,ปานกลาง,0,neutral,"2024-07-31 17:01:18","2024-07-31 17:01:18"
280,"อาจารย์ค่อนข้างสอนไว ตามไม่ทัน แต่ยังพอทำได้บ้างค่ะ",999,negative,"2024-07-31 17:01:18","2024-07-31 17:01:18"
281,ดีมากครับ,83.33,positive,"2024-07-31 17:01:18","2024-07-31 17:01:18"
282,คอมแย่มากครับเรียนตามไม่ทันค้างตลอด,96,negative,"2024-07-31 17:01:18","2024-07-31 17:01:18"
283,"สอนเร็วมาก  คอมก็ช้ามาก",999,negative,"2024-07-31 17:01:18","2024-07-31 17:01:18"
284,ห้องคอมพิวเตอร์ช้าและค้างบ่อย,88.89,negative,"2024-07-31 17:01:18","2024-07-31 17:01:18"
285,"อยากให้เข้าถึงกับศึกษาทุกคน สามารถปรึกษาได้ตลอดเวลา",0,neutral,"2024-07-31 17:01:18","2024-07-31 17:01:18"
286,อาจารย์สอนช้าๆบ้างนะครับ,66.67,negative,"2024-07-31 17:01:18","2024-07-31 17:01:18"
287,อาจารย์สอนดีมากค่ะ,83.33,positive,"2024-07-31 17:01:18","2024-07-31 17:01:18"
288,ปานกลาง,0,neutral,"2024-07-31 17:01:18","2024-07-31 17:01:18"
289,สอนตรงดีครับ,75,positive,"2024-07-31 17:01:18","2024-07-31 17:01:18"
290,"เร็วไปนิดนะครับ ผมตามไม่ทัน 555",999,negative,"2024-07-31 17:01:18","2024-07-31 17:01:18"
291,อาจารย์เป็นคนที่มีสกิลในการเขียนเทพมากคร้า,66.67,positive,"2024-07-31 17:01:18","2024-07-31 17:01:18"
292,"อาจาร์ยสอนดีมาก แต่สอนเร็วไปหน่อย แต่ไปถามนอกรอบอาจาร์ยก็อธิบายได้เข้าใจ",999,negative,"2024-07-31 17:01:18","2024-07-31 17:01:18"
293,อาจารย์สอนเร็วไปจนตามไม่ค่อยทันครับ,999,negative,"2024-07-31 17:01:18","2024-07-31 17:01:18"
294,"อาจารย์สอนไปไวมากตามไม่ทันเลยครับ
อยากให้อาจารย์สอนช้าลง
เพราะบ้างคนยังไม่เคยเรียนมาแล้วทำให้ตามไม่ทันบวกกับอาจารย์สอนไวอีกจบเลย",999,negative,"2024-07-31 17:01:18","2024-07-31 17:01:18"
295,ช่วยอธิบายเนื้อหาอย่างละเอียดให้เเก่นักศึกษารู้ถึงที่มาเกี่ยวกับเนื้อหานั้นๆ,0,neutral,"2024-07-31 17:01:18","2024-07-31 17:01:18"
296,"อาจารย์สอนดีมากครับบ คอยถามเสมอว่ามีใครไม่เข้าใจตรงไหนบ้างแล้วอาจารย์จะทบทวนให้",62.5,positive,"2024-07-31 17:01:18","2024-07-31 17:01:18"
297,อาจารย์สอนไวมากเลยคะ,999,negative,"2024-07-31 17:01:18","2024-07-31 17:01:18"
298,อาจารย์สอนเร็วไปนะครับอยากให้ช้าลงหน่อยเด็กๆตามไม่ค่อยทันครับ,999,negative,"2024-07-31 17:01:18","2024-07-31 17:01:18"
299,"อาจารย์สอนเร็วตามไม่ทัน อยากให้อาจารย์สอนช้าลงหน่อยครับ",999,negative,"2024-07-31 17:01:18","2024-07-31 17:01:18"
300,"อาจารย์สอนไปไวมากตามไม่ทันเลยครับ
อยากให้อาจารย์สอนช้าลง
เพราะบ้างคนยังไม่เคยเรียนมาแล้วทำให้ตามไม่ทันบวกกับอาจารย์สอนไวอีกจบเลย",999,negative,"2024-07-31 17:01:18","2024-07-31 17:01:18"
301,อ่านลายมืออาจารย์ไม่ค่อยออกครับ,0,neutral,"2024-07-31 17:01:18","2024-07-31 17:01:18"
302,"สอนช้าๆ เขียนตัวใหญ่ๆ หลังห้องมองไม่ค่อยเห็นครับ",66.67,negative,"2024-07-31 17:01:18","2024-07-31 17:01:18"
303,สอนเร็วเกินไปนศ.บางคนไม่มีพื้นฐานจึกทำความเขาใจได้ยาก,999,negative,"2024-07-31 17:01:18","2024-07-31 17:01:18"
304,"โปรเจคเตอร์ภาพไม่ชัดเลยครับ เเอร์ร้อนมากๆ",75,negative,"2024-07-31 17:01:18","2024-07-31 17:01:18"
305,อยากให้สอนช้ากว่านี้หน่อยครับเหมือนฟังแรปเลยครับตอนเรียน,80,negative,"2024-07-31 17:01:18","2024-07-31 17:01:18"
306,"อาจารย์สอนดี แต่ผมอยากให้ปรับปรุงลายมือสักนิด. ผมมึนไปหมดแล้ว",0,neutral,"2024-07-31 17:01:18","2024-07-31 17:01:18"
307,อาจารย์สอนเร็วเกินไป,999,negative,"2024-07-31 17:01:18","2024-07-31 17:01:18"
308,งานเยอะ,0,neutral,"2024-07-31 17:01:18","2024-07-31 17:01:18"
309,งานเยอะไปหน่อยค่ะ55555555,66.67,negative,"2024-07-31 17:01:18","2024-07-31 17:01:18"
310,เรียนสนุกมากครับอาจารย์อารมณ์ดีเป็นมิตรกัยนักศึกษาครับ,88.89,positive,"2024-07-31 17:01:18","2024-07-31 17:01:18"
311,"อย่าพยายามพูดนอกเหนือการสอนเยอะนะครับ นศ.บางคนเค้าไม่ได้อยากรับรู้นะครับจารย์ กราบเรียนมาเพื่อแนะนำ ไม่ได้ว่าหรือถือโกรธ ถือว่าผมแนะนำ",0,neutral,"2024-07-31 17:01:18","2024-07-31 17:01:18"
312,"สอนเข้าใจดี แต่สอนเร็วไป นักศึกษาบางคนตามไม่ทัน งานเยอะมาก ควรให้พักบ้างระหว่างเรียน",999,negative,"2024-07-31 17:01:18","2024-07-31 17:01:18"
313,สบายใจในกาารเรียนมากครับ,66.67,positive,"2024-07-31 17:01:18","2024-07-31 17:01:18"
314,"ให้งานเยอะ แต่ให้เวลาทำน้อย บางทีคนที่เรียนไม่มีอุปกรณ์ หรืออุปกรณ์ไม่พร้อมในการทำงาน ไม่มีการเปลี่ยนงานให้กับคนที่เรียน หรือไม่ค่อยฟังความคิดเห็นนักศึกษาเท่าที่ควร",66.67,negative,"2024-07-31 17:01:18","2024-07-31 17:01:18"
315,"อาจารย์ควรมีแบบแผนในการสินมากกว่านี้ เช่นเตรียมการสอนมาว่าวันนี้จะสอนอะไร งานกี่ชิ้นไม่ใช่คิดเอาหน้างานแบบอยากจะสั่งก็สั่งเลย อาจารย์สั่งงานบางคาบ10ชิ้นต่อคาบ ส่งภายใน 5โมงเย็น บางที นศ ทำไม่ทัน และนักศึกษาแต่ละคนอุปกรณ์ไม่ได้ครบทุดคนบางคนเรียนจบคลาสก่อนถีงจะวิ่งไปยืมเครื่องเพื่อนทำได้ในวันต่อไป พอไปทำวันต่อไปมันก็ขึ้นส่งช้า คะอนนก็ลดลงทั้งที นศก็มีความกะตือรือร้นอยาดจะทำส่งเพียงแค่ขอเวลา อาจารย์ควรให้เวลางานละสัปดาห์ชนสัปห์ดา แบบว่า3ชิ้นนี้ส่งได้ถึงวีคหน้า หมดวีคหน้าประมาณนี้ แต่ความรู้ที่อาตารย์ให้ในหลายๆโแรแกรมก็คือมาก ไม่เถียงเลยอาจารย์สอนเีแต่การสั่งงานต้อฃปรับลเให้น้อยลงไปบ้าง",85.71,negative,"2024-07-31 17:01:18","2024-07-31 17:01:18"
316,"อยากให้อาจารย์เตียมความพร้อมในการเตรียมการเรียนการสอน พวกเเอปพลิดคชั่นต่างๆ รวมๆสอนดีเป็นกันเองกับเด็ก",85.71,positive,"2024-07-31 17:01:18","2024-07-31 17:01:18"
317,อยากให้อาจารย์ปรับการให้การบ้านนักศึกษาเพราะบาวคนอาจไม่มีคอมไม่มีโปรแกรมบางคนทำงานหาค่าเทอมเองอยสกให้เข้าใจและสั่งงานน้อยบงหน่อยค่ะ,66.67,positive,"2024-07-31 17:01:18","2024-07-31 17:01:18"
318,"ด้วยรูปแบบการเรียนการสอนออนไลน์ บางส่วนนักศึกษาไม่มีความพร้อมหรือความสามารถในการทำงานเช่นเรื่องทุนศัพท์ในการซื้อโปรแกรมหรืออุปกรณ์การเรียน อยากให้อาจารย์ปรับเนื้อหาการสอนให้เหมาะสมกับตัวนักศึกษาด้วยค่ะ",66.67,positive,"2024-07-31 17:01:18","2024-07-31 17:01:18"
319,"ตรงๆเลยนะคะ จริงๆแล้วอาจารย์ควรจะปรับปรุงการสอนให้สอดคล้องกับสถานการณ์แล้วไม่ใช่เด็กทุกคนเรียนคอมแล้วต้องมีแอปนู้นแอปนี้นะคะ หนูเสียเงิน1000กว่าบอกเพื่อซื้อแอปมาทำงานและหนูใช้ครั้งเดียวแล้วไม่เกี่ยวกับสายงานหนูด้วยค่ะ อยากให้อาจารย์เอาตรงนี้ไปปรับปรุงตรวจสอบนักศึกษาให้เข้าใจ การเรียนแบบนี้ควรเรียนที่มหาลัยค่ะ การหาแอปการเรียนการสอนไม่ใช้เรื่องของนักศึกษาที่ต้องรับผิดชอบแต่เป็นเป็นมหาลัยที่ต้องจัดการและตัวอาจารย์เอง ขอบคุณค่ะ",80,positive,"2024-07-31 17:01:18","2024-07-31 17:01:18"
320,"อาจารย์อย่าขี่จรวจสอนอีกเลยนะคะ สงสารรุ่นถัดไป ถือว่านศ.ขอร้อง",66.67,negative,"2024-07-31 17:01:18","2024-07-31 17:01:18"
321,"อาจารย์สอนอะไรเยอะแยะเลย ปรับใช้ได้จริง",66.67,positive,"2024-07-31 17:01:18","2024-07-31 17:01:18"
322,"สอนดีมากครับ แต่อยากให้ปรับเนื้อหาให้เข้าใจครับแต่โดยดีมากๆครับ",90.91,positive,"2024-07-31 17:01:18","2024-07-31 17:01:18"
