id,comment,score,polarity,created_at,updated_at
126,จารใจดีมากคับ,66.67,positive,"2024-07-31 17:01:18","2024-07-31 17:01:18"
127,"อาจารย์สอนดีมากค่ะ ถึงจะเจอกันแค่คาบเดียวก็ตาม",83.33,positive,"2024-07-31 17:01:18","2024-07-31 17:01:18"
128,ไม่เคยเจออาจารย์,0,neutral,"2024-07-31 17:01:18","2024-07-31 17:01:18"
129,"ขอ mini project ง่ายๆหน่อยครับอาจารย์",0,neutral,"2024-07-31 17:01:18","2024-07-31 17:01:18"
130,"อาจารย์บางทีปล่อยช้า เนื้อหาที่สอน บางตัวไม่ได้ใช้ และ เวลาการสอนหลายๆบทเรียนไม่ทัน แต่รวมๆดีครับ ได้สนุกกับการเขียนเว็บมากๆ",66.67,negative,"2024-07-31 17:01:18","2024-07-31 17:01:18"
131,"ควรให้ pdf มาให้ เพื่อให้ทำความเข้าใจในการเรียนมากยิ้งขึ้นไม่ควรปล่อยเลทเกิน 10 นาทีอยากให้มีเวลาพักเบรคบ้างอัดความรู้มาเยอะจนรับไม่ไหวควรให้เวลาในการทำ project มากกว่านี้",92.31,negative,"2024-07-31 17:01:18","2024-07-31 17:01:18"
132,ควรสั่งงานแล้วให้กำหนดส่งก่อนสอบหรือก่อนช่วงสอบ,0,neutral,"2024-07-31 17:01:18","2024-07-31 17:01:18"
133,"มีสื่อการเรียนการสอนที่ละเอียด เข้าใจง่ายมากขึ้น อาจารย์สามารถให้คำปรึกษาเกี่ยวกับคอมพิวเตอร์ได้เข้าใจ เป็นกันเองไม่กดดันเด็ก มีอุปกรณ์ที่สะดวกในการสอน",96.97,positive,"2024-07-31 17:01:18","2024-07-31 17:01:18"
134,ดี,75,positive,"2024-07-31 17:01:18","2024-07-31 17:01:18"
135,เนื้อหาเยอะดีค่ะแต่ตามไม่ทัน,0,neutral,"2024-07-31 17:01:18","2024-07-31 17:01:18"
136,ดี,75,positive,"2024-07-31 17:01:18","2024-07-31 17:01:18"
137,"การเรียนการสอนดีมาก สอนได้เข้าใจและปฏิบัติตามได้ดี แต่ไม่ควรขึ้นเสียงใส่นักศึกษาในขณะที่นักศึกษาพูดจาดีๆด้วย การกระทำตุบโต๊ะและตะหวาดเสียงใส่นักศึกษาต่อหน้าทุกคนมันเป็นการกระทำที่ก่อให้เกิดความอับอาย เพราะไม่ใช่นักศึกษาทุกคนที่จะชอบด้านคอมพิวเตอร์หรือมีความรู้ด้านคอมพิวเตอร์ ควรจะใจเย็นและพูดจากับนักศึกษาให้ดีกว่านี้ การกระทำในวันนั้นมันทำให้นักศึกษาฝังใจและไม่อยากเรียนวิชาที่เกี่ยวกับคอมพิวเตอร์อีกเลย",99.59,positive,"2024-07-31 17:01:18","2024-07-31 17:01:18"
138,รักอาจารย์นะคะจุ้บๆ,75,positive,"2024-07-31 17:01:18","2024-07-31 17:01:18"
139,"อาจารย์ใจดีมากค่ะ ถามเยอะแค่ไหนก็คอยตอบตลอด ใส่ใจนักผศึกษาดีค่ะ",92.31,positive,"2024-07-31 17:01:18","2024-07-31 17:01:18"
140,สอนดี,75,positive,"2024-07-31 17:01:18","2024-07-31 17:01:18"
141,อาจารย์ใจดี,66.67,positive,"2024-07-31 17:01:18","2024-07-31 17:01:18"
142,อาจารย์ใส่ใจนักศึกษา,66.67,positive,"2024-07-31 17:01:18","2024-07-31 17:01:18"
143,"อาจารย์มีการสอนไปด้วย และแทรกอารมณ์ขัยเข้าไปด้วยเพื่อไม่ให้นักศึกษาเครียดเกินไป
และการเรียนการสอนในแต่ละอาทิตย์จะมีใบระบุเป็นกิจลักษณะชัดเจน",75,negative,"2024-07-31 17:01:18","2024-07-31 17:01:18"
144,"อาจารย์สอนดีมากครับ นักศึกษาเข้าใจง่าย",90.91,positive,"2024-07-31 17:01:18","2024-07-31 17:01:18"
145,สอนดีครับ,75,positive,"2024-07-31 17:01:18","2024-07-31 17:01:18"
146,อ.น่ารัก,80,positive,"2024-07-31 17:01:18","2024-07-31 17:01:18"
147,ดีเเล้วครับ,75,positive,"2024-07-31 17:01:18","2024-07-31 17:01:18"
148,วิธีสอนเข้าใจง่าย,66.67,positive,"2024-07-31 17:01:18","2024-07-31 17:01:18"
149,สอนดีแล้วครับ,75,positive,"2024-07-31 17:01:18","2024-07-31 17:01:18"
150,อาจารย์สอนดีครับ,75,positive,"2024-07-31 17:01:18","2024-07-31 17:01:18"
151,"บางทีอาจารย์สอนเร็วไปหน่อยค่ะ แต่โดยรวมแล้วอาจารย์สอนเข้าใจได้ง่าย ขอบคุณค่ะ :)",999,negative,"2024-07-31 17:01:18","2024-07-31 17:01:18"
152,สุดยอดอาจารย์,80,positive,"2024-07-31 17:01:18","2024-07-31 17:01:18"
153,ให้งานเยอะมากๆมีงานทุกคาบแต่ดีตรงที่อาจารย์มีคลิปย้อนหลังให้ขอAรัวๆเลยนะคะงานทุกงานถึงจะเยอะแต่ตั้งใจทำฝุดๆ,85.71,positive,"2024-07-31 17:01:18","2024-07-31 17:01:18"
154,"อาจารย์น่ารักมากๆค่ะ ใจดีพูดเพราะ อยากเรียนด้วยตลอดไปค่า",88.89,positive,"2024-07-31 17:01:18","2024-07-31 17:01:18"
155,"อาจารย์สอนดีเเละให้ปฏิบัติจริงซึ่งบางเรื่องที่หนูไม่เคยรู้เกี่ยวกับword powerpoint excel อาจารย์ก็ทำให้รู้เเละเข้าใจนำไปใช้ได้จริง ปกติหนูจะกลัวการเรียนคอมมาตลอดเเต่ครั้งนี้อาจารย์ทำให้มันต่างออกไป หนูอยากเรียนเเต่สนใจมากขึ้น ขอบคุณมากๆค่ะอาจารย์",96.43,positive,"2024-07-31 17:01:18","2024-07-31 17:01:18"
156,เยี่ยมๆๆๆ,66.67,positive,"2024-07-31 17:01:18","2024-07-31 17:01:18"
157,"อาจารย์ใจดีค่ะ น่ารักการบ้านยากบ้างง่ายบ้าง ส่งช้าอาจารย์ตามงานด้วย",57.14,positive,"2024-07-31 17:01:18","2024-07-31 17:01:18"
158,"ตอนสอบเราต้องการสมาธิมากๆค่ะ แต่ตลอดการสอบอาจารจะพูดคุยหรือบางครั้งก็ขำคิกคักตลอดค่ะ จริงๆอาจารคุยได้นะคะแต่ปิดไมค์เถอะค่ะ เด็กไม่มีสมาธิ เวลาให้ทำข้อสอบก็น้อย อาจารยังพูดเสียงดังอีกค่ะ การเรียนการสอนดีมากแล้ว ติดแค่ตรงนี้ค่ะ",83.33,positive,"2024-07-31 17:01:18","2024-07-31 17:01:18"
159,"อ.สอนดีครับ มนุษย์สัมพันธ์กับนักศึกษาดี เข้าใจนักศึกษา",94.74,positive,"2024-07-31 17:01:18","2024-07-31 17:01:18"
160,"อาจารย์สอนดีมากๆเลยค่ะ ให้ปฏิบัติจริงๆ รักอาจารย์นะคะจุ๊บๆ",90,positive,"2024-07-31 17:01:18","2024-07-31 17:01:18"
161,ตรวจงานเช้าไปหน่อยครับแก้งานไม่ทัน55555,75,negative,"2024-07-31 17:01:18","2024-07-31 17:01:18"
162,สอนดีมากครับ,83.33,positive,"2024-07-31 17:01:18","2024-07-31 17:01:18"
163,"อาจารย์สอนดีมากๆค่ะ ไม่เข้าใจตรงไหนถามได้ แล้วเดินเข้ามาอธิบายให้ฟังอีกรอบแบบไม่บ่นเลยค่ะ สอนแบบเข้าใจมากด้วยสามารถเอาไปใช้ในชีวิตประจำวันได้",88.89,positive,"2024-07-31 17:01:18","2024-07-31 17:01:18"
164,"เรียนกับอาจารย์สนุกดีค่ะ มีวิดิโอย้อนหลังให้ด้วย เป็นกำลังใจให้อาจารย์สอนต่อไปนะค่ะ<3",85.71,positive,"2024-07-31 17:01:18","2024-07-31 17:01:18"
165,"อาจารย์สอนดีมากครับ เวลานักศึกษาไม่เข้าใจ ก็เดินสอนอย่างทั่วถึงครับ",62.5,positive,"2024-07-31 17:01:18","2024-07-31 17:01:18"
166,"อยากให้อุปกรใน มหาวิทยาลัย ดีกว่านี้",75,positive,"2024-07-31 17:01:18","2024-07-31 17:01:18"
167,"ไม่มีข้อเสนอแนะครับ เพราะอาจารย์สอนดีครับแล้วเข้าใจง่าย",85.71,positive,"2024-07-31 17:01:18","2024-07-31 17:01:18"
168,สอนเข้าใจดี,85.71,positive,"2024-07-31 17:01:18","2024-07-31 17:01:18"
169,อาจารย์น่ารักและตามงานเด็กสนใจเด็กเป็นอย่างมากค่ะให้คำแนะนำได้ดีค่ะ,96,positive,"2024-07-31 17:01:18","2024-07-31 17:01:18"
170,"อาจารย์ใจดี ช่วยสอนนศ.ถ้านศไม่เข้าใจในห้อง",60,negative,"2024-07-31 17:01:18","2024-07-31 17:01:18"
171,"อาจารย์สอนเข้าใจดีเลยครับ อุปกรณ์การสอนครบถ้วนน",85.71,positive,"2024-07-31 17:01:18","2024-07-31 17:01:18"
172,สอนไวไป,999,negative,"2024-07-31 17:01:18","2024-07-31 17:01:18"
173,"อาจารย์ตั้งใจสอน และใจดีมากๆค่ะ",80,positive,"2024-07-31 17:01:18","2024-07-31 17:01:18"
174,"อาจารย์สอนเข้าใจให้งานไวแล้วก็พูดดีมากๆด้วยค่ะ เนื้อหาครบ แต่อยากให้อาจารย์พูดลดความเร็วตอนสอนลงนิดนึงค่ะ ขอบคุณค่ะอาจารย์สำหรับเทอมนี้ ขอ A ทีนะคะ",999,negative,"2024-07-31 17:01:18","2024-07-31 17:01:18"
175,ครูผู้สอนใจดีมากไม่เข้าใจตรงไหนถามได้ตลอด,60,negative,"2024-07-31 17:01:18","2024-07-31 17:01:18"
176,"อาจารย์ใจดีมากค่ะ หนูอยากเรียนกับอาจารย์อีกนะคะ",66.67,positive,"2024-07-31 17:01:18","2024-07-31 17:01:18"
177,"สอนดีมากค่าาา เข้าใจละเอียดยิบ ไม่ดุ",95.24,positive,"2024-07-31 17:01:18","2024-07-31 17:01:18"
178,อาจารย์น่ารักมากครับ,80,positive,"2024-07-31 17:01:18","2024-07-31 17:01:18"
179,"อาจารย์สอนดีมากค่ะ ขอโทษที่ขาดเรียนบ่อยนะคะ",90.91,positive,"2024-07-31 17:01:18","2024-07-31 17:01:18"
180,ขอบคุณอาจารย์ที่สอนมาอย่างดีครับผม,85.71,positive,"2024-07-31 17:01:18","2024-07-31 17:01:18"
181,"อาจารย์สอนเข้าใจดีค่ะ แต่อาจารย์พูดเร็วเกิน รอนักศึกษาก่อน555",999,negative,"2024-07-31 17:01:18","2024-07-31 17:01:18"
182,"สุดติ่งกระดิ่งแมว โอ้โหเฮะ",66.67,positive,"2024-07-31 17:01:18","2024-07-31 17:01:18"
183,สอนได้เยี่ยมมากๆ,66.67,positive,"2024-07-31 17:01:18","2024-07-31 17:01:18"
184,ปานกลาง,0,neutral,"2024-07-31 17:01:18","2024-07-31 17:01:18"
185,"อาจารย์สอนเร็วมากๆ นักศึกษาเรียนตามไม่ทัน แล้วแล็คเซอร์ไม่ทัน ทำให้เกิดผลสอบน้อยกว่าเกณฑ์",999,negative,"2024-07-31 17:01:18","2024-07-31 17:01:18"
186,"สอนเข้าใจง่าย แสอนเข้าใจง่าย แต่เวลาออกข้อสอบยากมากมากคะ อยากให้อาจารย์ออกง่ายกว่านี้นิดหนึ่ง #อาจารย์น่ารัก",91.43,positive,"2024-07-31 17:01:18","2024-07-31 17:01:18"
187,สอนดีค่ะ,75,positive,"2024-07-31 17:01:18","2024-07-31 17:01:18"
188,ชอบอาจารย์สอนดีค่ะ,90,positive,"2024-07-31 17:01:18","2024-07-31 17:01:18"
189,"สอนแน่นมากค่ะ ตรงเวลาเป๊ะๆ",80,positive,"2024-07-31 17:01:18","2024-07-31 17:01:18"
190,อยากให้อาจารย์รับความคิดเห็นของนักศึกษาบ้างค่ะ,0,neutral,"2024-07-31 17:01:18","2024-07-31 17:01:18"
191,"อาจารย์สอนดีมากค่ะ ทำให้เข้าใจอะไรที่เราไม่รู้มากขึ้น",90.91,positive,"2024-07-31 17:01:18","2024-07-31 17:01:18"
192,"อาจารย์ก็สอนดีนะคะ แต่บางครั้งอาจารย์ให้นักศึกษารอแล้วจะมาบอกที่หลังอย่างนี่พอนักศึกษามาถามอาจารย์กลับว่าให้นักศึกษาใช่หรอคะ บางครั้งอาจารย์ก็สอนเร็วเกินไปจนนักศึกษาตามไม่ทัน อย่างคลาสสุดท้ายที่อาจารย์กลัวสอนพวกหนูไม่ทันนั้นอึกเป็นความผิดของอาจารย์หรือเปล่าที่อีกอาทิตย์อาจารย์ไม่มาสอนเองแล้วยังจะมาเร่งนักศึกษาอีกใช่หรอค่ะ",999,negative,"2024-07-31 17:01:18","2024-07-31 17:01:18"
193,สอนดีมาก,83.33,positive,"2024-07-31 17:01:18","2024-07-31 17:01:18"
194,"ไม่มีการอนุโลมให้นักศึกษา บางครั้งส่งงานช้านิดหน่อย(แต่ไม่ได้ช้าจนน่าเกลียด)ก็หักคะแนน หรือบางครั้งก็ไม่รับส่งงานจากนักศึกษาเลย แต่เข้าสอนและเลิกสอนตรงตามเวลาดีมาก",54.55,negative,"2024-07-31 17:01:18","2024-07-31 17:01:18"
195,อยากให้อาจารย์พูดช้าลงกว่านี้นิดหน่อย,80,negative,"2024-07-31 17:01:18","2024-07-31 17:01:18"
196,"แอร์ที่ห้องเรียนร้อนทุกสัปดาห์ อยากให้ปรับปรุง",0,neutral,"2024-07-31 17:01:18","2024-07-31 17:01:18"
197,อาจารย์ควรมีไมค์นะคะ,0,neutral,"2024-07-31 17:01:18","2024-07-31 17:01:18"
198,"อาจารย์ใจดีคะ ถ้าใครไม่เข้าใจอาจารย์ก็จะอธิบายให้เข้าใจมากขึ้น มีแบบฝึกหัดมากให้ทำเสมอ มีสื่อประกอบการเรียนเสมอ ได้ทำแบบฝึกหัดตามอาจารย์ไปพร้อมกันซึ่งสามารถนำไปใช้ในชีวิตประจำวันได้ด้วยคะ",57.14,positive,"2024-07-31 17:01:18","2024-07-31 17:01:18"
199,แอร์ร้อนมากกก,0,neutral,"2024-07-31 17:01:18","2024-07-31 17:01:18"
200,อาจารย์สอนบางทีไม่ค่อยเข้าใจคะอาจารย์ชอบพูดไวตามไม่ค่อยทันคะ,999,negative,"2024-07-31 17:01:18","2024-07-31 17:01:18"
201,"อาจารย์สอนสนุกมากเข้าใจง่าย แต่อยากให้อาจารย์ช้าลงนิดนึงเพราะเป็นวิชาคอม ต้องปฏิบัติตลอด",0,neutral,"2024-07-31 17:01:18","2024-07-31 17:01:18"
202,อยากให้ลดความเร็วในการสอนและทวนการเรียนอีกครั้ง,999,negative,"2024-07-31 17:01:18","2024-07-31 17:01:18"
203,ขอบคุณที่เข้าใจนักศึกษา,85.71,positive,"2024-07-31 17:01:18","2024-07-31 17:01:18"
204,อาจารย์สอนดีเข้าใจง่าย,85.71,positive,"2024-07-31 17:01:18","2024-07-31 17:01:18"
205,"อยากให้อาจารย์สอนช้าลงนิดนึง สอนเนื้อหาปฏิบัติให้ง่ายขึ้น ขยายระยะเวลาในการส่งงาน หรือลดจำนวนงานลง",66.67,negative,"2024-07-31 17:01:18","2024-07-31 17:01:18"
206,สอนเร็วไป,999,negative,"2024-07-31 17:01:18","2024-07-31 17:01:18"
207,ขอบคุณครับอาจารย์,75,positive,"2024-07-31 17:01:18","2024-07-31 17:01:18"
208,นำไปปรับใช้ได้จริงนอกชั้นเรียน,66.67,positive,"2024-07-31 17:01:18","2024-07-31 17:01:18"
209,"อาจารย์ให้คำแนะนำดีมากครับ ชอบที่อาจารย์เข้าใจนักศึกษาอยากให้มีอาจารย์ที่มีความคิดแบบอาจารย์เยอะๆจังครับชอบการสอนของอาจารย์ด้วยครับ",97.3,positive,"2024-07-31 17:01:18","2024-07-31 17:01:18"
210,อาจารย์สอนดีแต่สอนไวไปในบางที,999,negative,"2024-07-31 17:01:18","2024-07-31 17:01:18"
211,อยากให้อาจารย์ออกสูตรเกี่ยวกับข้อเขียนลดลงหน่อยค่ะ,66.67,negative,"2024-07-31 17:01:18","2024-07-31 17:01:18"
212,"อาจารย์สอนเข้าใจง่าย และยืดหยุ่นกับนักศึกษาถ้าเกิดเหตุนักศึกษาส่วนใหญ่ไม่สามารถออนไซต์ได้ก็ยืดหยุ่นให้ออนไลน์ได้ซึ่งดีมากๆค่ะ",80,positive,"2024-07-31 17:01:18","2024-07-31 17:01:18"
213,"อาจารย์สอนเร็วบ้างในบางเนื้อหา ตามไม่ทัน",999,negative,"2024-07-31 17:01:18","2024-07-31 17:01:18"
214,อาจารย์สอนดีมากค่ะ,83.33,positive,"2024-07-31 17:01:18","2024-07-31 17:01:18"
215,"ใช้คำพูดไม่เหมาะสม สอนรู้เรื่องบางไม่รู้เรื่องบาง การที่ให้เรียนออนไลน์เสาร์อาทิตย์ซึ่งบางคนไม่มีเวลาเพราะต้องทำงานเสริมลาไม่ได้ ให้สอบ2ทุ่ม?วันเสาร์อาทิตย์ บางคนเขาทำงานแล้งไม่มีมีเวลาทำ แทนที่จะให้ทำในคลาสเรียน สั่งงานไม่นึกถึงนักศึกษา เพราะงานที่เขาสั่งต้องใช้คอมหรือไอแพตซึ่งบางคนไม่มีเลยไม่ได้ทำส่งเลยเสียคะแนนไปเปล่าๆ การใช้โทรศัพท์มันไม่สะดวกขนาดนั้น ให้คะแนนยากก็ยาก ควรปรับปรุงมากๆค่ะ",99.96,negative,"2024-07-31 17:01:18","2024-07-31 17:01:18"
216,อาจารย์ใจดีมากค่ะๆสอนดีมากเข้าใจ,95.24,positive,"2024-07-31 17:01:18","2024-07-31 17:01:18"
217,อาจารย์ใจดี,66.67,positive,"2024-07-31 17:01:18","2024-07-31 17:01:18"
218,"อยากให้อาจารย์นำเสนอการสอนที่สามารถเข้าใจง่ายและนำไปใช้ในชีวิตจริงได้มากกว่านี้ ให้นักศึกษารู้ว่าสามารถเอาไปใช้กับงานในอนาคตได้ยังไง เละเกี่ยวข้องกับงานของเรายังไงอยากให้อาจารย์เตรียมการสอนที่พร้อมกว่านี้ค่ะ",0,neutral,"2024-07-31 17:01:18","2024-07-31 17:01:18"
219,อาจารย์น่ารักมากๆสอนเข้าใจง่ายมีงานกลุ่มให้ทำกับเพื่อนตลอด,88.89,positive,"2024-07-31 17:01:18","2024-07-31 17:01:18"
220,ขอบคุณที่คอยให้คำแนะนำในหลายๆเรื่องครับ,75,positive,"2024-07-31 17:01:18","2024-07-31 17:01:18"
221,ส่งงานย้อนหลังไม่ได้ค่ะ,0,neutral,"2024-07-31 17:01:18","2024-07-31 17:01:18"
222,อ.มีการสอนแบบรวบรัดเนื้อหาเข้าใจได้ง่ายโดยภาพรวมถือเป็นที่น่าประทับใจ,96,positive,"2024-07-31 17:01:18","2024-07-31 17:01:18"
223,"อาจารย์ทำการสอนดีเข้าใจง่ายแต่เนื้อหาอาจมีเยอะยากที่จะสรุปไปบ้าง แต่ก็ถูกแทนด้วยความใจดีและให้โอกาสนักศึกษาได้ลองผิดถูกก่อนการวัดปลจริงมีแบบทดสอบต่างๆที่พัฒนาการช่วยจำได้ดีและยังน่าสนใจคับ",99.08,positive,"2024-07-31 17:01:18","2024-07-31 17:01:18"
224,"เป็นอาจารย์ที่ดีมากครับ  ไม่กดดัน เด็กเลย",66.67,positive,"2024-07-31 17:01:18","2024-07-31 17:01:18"
225,ขอบคุณที่ให้ความช่วยเหลือตลอด,85.71,positive,"2024-07-31 17:01:18","2024-07-31 17:01:18"
226,อาจารย์คอยช่วยเหลือและให้คำแนะนำดีมากครับ,80,positive,"2024-07-31 17:01:18","2024-07-31 17:01:18"
227,"อาจารย์สอนเก่งมาก ๆ ให้ความช่วยเหลือดี",94.74,positive,"2024-07-31 17:01:18","2024-07-31 17:01:18"
228,สอนดีแล้วครับ,75,positive,"2024-07-31 17:01:18","2024-07-31 17:01:18"
